Short SAS name,Long SAS name,Label,Type,Length,Carrier file sequence1,New variables
BENE_ID,BENE_ID,Encrypted CCW Beneficiary ID,CHAR,15.0,1.0,
CLM_ID,CLM_ID,Claim ID,CHAR,15.0,2.0,
LINE_NUM,LINE_NUM,Claim Line Number,NUM,13.0,3.0,
CLM_TYPE,NCH_CLM_TYPE_CD,NCH Claim Type Code,CHAR,2.0,4.0,
THRU_DT,CLM_THRU_DT,Claim Through Date,DATE,8.0,5.0,
PRF_PRFL,CARR_PRFRNG_PIN_NUM,Carrier Line Performing Provider ID Number (PIN),CHAR,15.0,6.0,
PRF_UPIN,PRF_PHYSN_UPIN,Carrier Line Performing UPIN Number,CHAR,12.0,7.0,
PRFNPI,PRF_PHYSN_NPI,Carrier Line Performing NPI Number,CHAR,12.0,8.0,
PRGRPNPI,ORG_NPI_NUM,Carrier Line Performing Group NPI Number,CHAR,10.0,9.0,
PRV_TYPE,CARR_LINE_PRVDR_TYPE_CD,Carrier Line Provider Type Code,CHAR,1.0,10.0,
TAX_NUM,TAX_NUM,Line Provider Tax Number,CHAR,10.0,11.0,
PRVSTATE,PRVDR_STATE_CD,Line Provider State Code (SSA),CHAR,2.0,12.0,
PROVZIP,PRVDR_ZIP,Carrier Line Performing Provider ZIP Code,CHAR,9.0,13.0,
HCFASPCL,PRVDR_SPCLTY,Line CMS Provider Specialty Code,CHAR,3.0,14.0,
PRTCPTG,PRTCPTNG_IND_CD,Line Provider Participating Indicator Code,CHAR,1.0,15.0,
ASTNT_CD,CARR_LINE_RDCD_PMT_PHYS_ASTN_C,Carrier Line Reduced Payment Physician Assistant Code,CHAR,1.0,16.0,
SRVC_CNT,LINE_SRVC_CNT,Line Service Count,NUM,4.0,17.0,
TYPSRVCB,LINE_CMS_TYPE_SRVC_CD,Line CMS Type Service Code,CHAR,1.0,18.0,
PLCSRVC,LINE_PLACE_OF_SRVC_CD,Line Place of Service Code,CHAR,2.0,19.0,
LCLTY_CD,CARR_LINE_PRCNG_LCLTY_CD,Carrier Line Pricing Locality Code,CHAR,2.0,20.0,
EXPNSDT1,LINE_1ST_EXPNS_DT,Line First Expense Date,DATE,8.0,21.0,
EXPNSDT2,LINE_LAST_EXPNS_DT,Line Last Expense Date,DATE,8.0,22.0,
HCPCS_CD,HCPCS_CD,Healthcare Common Procedure Coding System (HCPCS) Code,CHAR,5.0,23.0,
MDFR_CD1,HCPCS_1ST_MDFR_CD,HCPCS Initial Modifier Code,CHAR,5.0,24.0,
MDFR_CD2,HCPCS_2ND_MDFR_CD,HCPCS Second Modifier Code,CHAR,5.0,25.0,
BETOS,BETOS_CD,Line Berenson-Eggers Type of Service (BETOS) Code,CHAR,3.0,26.0,
LINEPMT,LINE_NCH_PMT_AMT,Line NCH Medicare Payment Amount,NUM,12.0,27.0,
LBENPMT,LINE_BENE_PMT_AMT,Line Payment Amount to Beneficiary,NUM,12.0,28.0,
LPRVPMT,LINE_PRVDR_PMT_AMT,Line Provider Payment Amount,NUM,12.0,29.0,
LDEDAMT,LINE_BENE_PTB_DDCTBL_AMT,Line Beneficiary Part B Deductible Amount,NUM,12.0,30.0,
LPRPAYCD,LINE_BENE_PRMRY_PYR_CD,Line Primary Payer Code (if not Medicare),CHAR,1.0,31.0,
LPRPDAMT,LINE_BENE_PRMRY_PYR_PD_AMT,Line Primary Payer (if not Medicare) Paid Amount,NUM,12.0,32.0,
COINAMT,LINE_COINSRNC_AMT,Line Beneficiary Coinsurance Amount,NUM,12.0,33.0,
LSBMTCHG,LINE_SBMTD_CHRG_AMT,Line Submitted Charge Amount,NUM,12.0,34.0,
LALOWCHG,LINE_ALOWD_CHRG_AMT,Line Allowed Charge Amount,NUM,12.0,35.0,
PRCNGIND,LINE_PRCSG_IND_CD,Line Processing Indicator Code,CHAR,2.0,36.0,
PMTINDSW,LINE_PMT_80_100_CD,Line Payment 80% / 100% Code,CHAR,1.0,37.0,
DED_SW,LINE_SERVICE_DEDUCTIBLE,Line Service Deductible Indicator Switch,CHAR,1.0,38.0,
MTUS_CNT,CARR_LINE_MTUS_CNT,Carrier Line Miles/Time/Units/Services (MTUS) Count ,NUM,11.0,39.0,
MTUS_IND,CARR_LINE_MTUS_CD,Carrier Line Miles/Time/Units/Services (MTUS) Indicator Code,CHAR,1.0,40.0,
LINE_ICD_DGNS_CD,LINE_ICD_DGNS_CD,Line Diagnosis Code,CHAR,7.0,41.0,
LINE_ICD_DGNS_VRSN_CD,LINE_ICD_DGNS_VRSN_CD,Line Diagnosis Code Diagnosis Version Code (ICD-9 or ICD-10),CHAR,1.0,42.0,
HPSASCCD,HPSA_SCRCTY_IND_CD,Carrier Line Health Professional Shortage Area (HPSA) / Scarcity Indicator Code,CHAR,1.0,43.0,
CARRXNUM,CARR_LINE_RX_NUM,Carrier Line RX Number,CHAR,30.0,44.0,
HCTHGBRS,LINE_HCT_HGB_RSLT_NUM,Hematocrit / Hemoglobin Test Results,NUM,4.0,45.0,
HCTHGBTP,LINE_HCT_HGB_TYPE_CD,Hematocrit / Hemoglobin Test Type Code,CHAR,2.0,46.0,
LNNDCCD,LINE_NDC_CD,Line National Drug Code (NDC),CHAR,11.0,47.0,
CARR_LINE_CLIA_LAB_NUM,CARR_LINE_CLIA_LAB_NUM,Clinical Laboratory Improvement Amendments (CLIA) monitored laboratory number,CHAR,10.0,48.0,
CARR_LINE_ANSTHSA_UNIT_CNT,CARR_LINE_ANSTHSA_UNIT_CNT,Carrier Line Anesthesia Unit Count,NUM,2.0,49.0,
CARR_LINE_CL_CHRG_AMT,CARR_LINE_CL_CHRG_AMT,Carrier Line Clinical Lab Charge Amount,NUM,12.0,50.0,
PHYSN_ZIP_CD,PHYSN_ZIP_CD,Line Place of Service (POS) Physician Zip Code,CHAR,15.0,51.0,
LINE_OTHR_APLD_IND_CD1,LINE_OTHR_APLD_IND_CD1,Line Other Applied Indicator 1st Code ,CHAR,2.0,52.0,
LINE_OTHR_APLD_IND_CD2,LINE_OTHR_APLD_IND_CD2,Line Other Applied Indicator 2nd Code,CHAR,2.0,53.0,
LINE_OTHR_APLD_IND_CD3,LINE_OTHR_APLD_IND_CD3,Line Other Applied Indicator 3rd Code,CHAR,2.0,54.0,
LINE_OTHR_APLD_IND_CD4,LINE_OTHR_APLD_IND_CD4,Line Other Applied Indicator 4th Code,CHAR,2.0,55.0,
LINE_OTHR_APLD_IND_CD5,LINE_OTHR_APLD_IND_CD5,Line Other Applied Indicator 5th Code,CHAR,2.0,56.0,
LINE_OTHR_APLD_IND_CD6,LINE_OTHR_APLD_IND_CD6,Line Other Applied Indicator 6th Code,CHAR,2.0,57.0,
LINE_OTHR_APLD_IND_CD7,LINE_OTHR_APLD_IND_CD7,Line Other Applied Indicator 7th Code,CHAR,2.0,58.0,
LINE_OTHR_APLD_AMT1,LINE_OTHR_APLD_AMT1,Line Other Applied Amount for 1st Code,NUM,12.0,59.0,
LINE_OTHR_APLD_AMT2,LINE_OTHR_APLD_AMT2,Line Other Applied Amount for 2nd Code,NUM,12.0,60.0,
LINE_OTHR_APLD_AMT3,LINE_OTHR_APLD_AMT3,Line Other Applied Amount for 3rd Code,NUM,12.0,61.0,
LINE_OTHR_APLD_AMT4,LINE_OTHR_APLD_AMT4,Line Other Applied Amount for 4th Code,NUM,12.0,62.0,
LINE_OTHR_APLD_AMT5,LINE_OTHR_APLD_AMT5,Line Other Applied Amount for 5th Code,NUM,12.0,63.0,
LINE_OTHR_APLD_AMT6,LINE_OTHR_APLD_AMT6,Line Other Applied Amount for 6th Code,NUM,12.0,64.0,
LINE_OTHR_APLD_AMT7,LINE_OTHR_APLD_AMT7,Line Other Applied Amount for 7th Code,NUM,12.0,65.0,
THRPY_CAP_IND_CD1,THRPY_CAP_IND_CD1,Line Therapy cap Indicator 1 Code,CHAR,1.0,66.0,
THRPY_CAP_IND_CD2,THRPY_CAP_IND_CD2,Line Therapy cap Indicator 2 Code,CHAR,1.0,67.0,
THRPY_CAP_IND_CD3,THRPY_CAP_IND_CD3,Line Therapy cap Indicator 3 Code,CHAR,1.0,68.0,
THRPY_CAP_IND_CD4,THRPY_CAP_IND_CD4,Line Therapy cap Indicator 4 Code,CHAR,1.0,69.0,
THRPY_CAP_IND_CD5,THRPY_CAP_IND_CD5,Line Therapy cap Indicator 5 Code,CHAR,1.0,70.0,
CLM_NEXT_GNRTN_ACO_IND_CD1,CLM_NEXT_GNRTN_ACO_IND_CD1,Claim Next Generation (NG) Accountable Care Organization (ACO) Indicator Code - Population based payments (PBP),CHAR,1.0,71.0,
CLM_NEXT_GNRTN_ACO_IND_CD2,CLM_NEXT_GNRTN_ACO_IND_CD2,Claim Next Generation (NG) Accountable Care Organization (ACO) Indicator Code - Telehealth,CHAR,1.0,72.0,
CLM_NEXT_GNRTN_ACO_IND_CD3,CLM_NEXT_GNRTN_ACO_IND_CD3,Claim Next Generation (NG) Accountable Care Organization (ACO) Indicator Code - Post Discharge HH visits,CHAR,1.0,73.0,
CLM_NEXT_GNRTN_ACO_IND_CD4,CLM_NEXT_GNRTN_ACO_IND_CD4,Claim Next Generation (NG) Accountable Care Organization (ACO) Indicator Code - 3 day SNF waiver,CHAR,1.0,74.0,
CLM_NEXT_GNRTN_ACO_IND_CD5,CLM_NEXT_GNRTN_ACO_IND_CD5,Claim Next Generation (NG) Accountable Care Organization (ACO) Indicator Code - Capitation,CHAR,1.0,75.0,
CARR_LINE_MDPP_NPI_NUM,CARR_LINE_MDPP_NPI_NUM,Carrier Line Medicare Diabetes Prevention Program (MDPP) NPI Number,CHAR,10.0,76.0,
LINE_RSDL_PYMT_IND_CD,LINE_RSDL_PYMT_IND_CD,Line Residual Payment Indicator Code,CHAR,1.0,77.0,New2
LINE_RP_IND_CD,LINE_RP_IND_CD,Line Representative Payee (RP) Indicator Code,CHAR,1.0,78.0,New2
LINE_PRVDR_VLDTN_TYPE_CD,LINE_PRVDR_VLDTN_TYPE_CD,Line Provider Validation Type Code,CHAR,2.0,79.0,New2
LINE_VLNTRY_SRVC_IND_CD,LINE_VLNTRY_SRVC_IND_CD,Line Voluntary Service Indicator Code,CHAR,1.0,80.0,New3
LINE_ADJUST_GRP_CD,LINE_ADJUST_GRP_CD,Line Adjustment Group Code,CHAR,2.0,81.0,New5
LINE_ADJUST_RSN_CD,LINE_ADJUST_RSN_CD,Line Adjustment Reason Code,CHAR,5.0,82.0,New5
LINE_RA_RMRK_CD,LINE_RA_RMRK_CD,Line Remittance Advice Remark Code,CHAR,5.0,83.0,New5
